<?xml version="1.0" encoding="UTF-8"?>
<stati xmlns:xsi="http://www.w3.org/2001/XMLSchema-instance" xsi:noNamespaceSchemaLocation="../status.xsd"><stato timestamp="19-06-2020-15-06-51"><varOsservata nome="stato_accensione"><valore>accesa</valore></varOsservata><varOsservata nome="temperatura_macchinetta"><valore>15</valore></varOsservata><varOsservata nome="livello_acqua"><valore>50</valore></varOsservata><varOsservata nome="stato_erogazione"><valore>in corso</valore></varOsservata><varOsservata nome="stato_cialda"><valore>inserita</valore></varOsservata></stato><stato timestamp="19-06-2020-19-06-51"><varOsservata nome="stato_accensione"><valore>spenta</valore></varOsservata><varOsservata nome="temperatura_macchinetta"><valore>10</valore></varOsservata><varOsservata nome="livello_acqua"><valore>8</valore></varOsservata><varOsservata nome="stato_erogazione"><valore>finita</valore></varOsservata><varOsservata nome="stato_cialda"><valore>non inserita</valore></varOsservata></stato><stato timestamp="18-9-2020-14-59-13"><varOsservata nome="stato_accensione"><valore>spenta</valore></varOsservata><varOsservata nome="temperatura_macchinetta"><valore>10</valore></varOsservata><varOsservata nome="livello_acqua"><valore>8</valore></varOsservata><varOsservata nome="stato_erogazione"><valore>finita</valore></varOsservata><varOsservata nome="stato_cialda"><valore>non inserita</valore></varOsservata></stato><stato timestamp="18-9-2020-14-59-59"><varOsservata nome="stato_accensione"><valore>spenta</valore></varOsservata><varOsservata nome="temperatura_macchinetta"><valore>10</valore></varOsservata><varOsservata nome="livello_acqua"><valore>8</valore></varOsservata><varOsservata nome="stato_erogazione"><valore>finita</valore></varOsservata><varOsservata nome="stato_cialda"><valore>non inserita</valore></varOsservata></stato><stato timestamp="18-9-2020-15-00-04"><varOsservata nome="stato_accensione"><valore>spenta</valore></varOsservata><varOsservata nome="temperatura_macchinetta"><valore>10</valore></varOsservata><varOsservata nome="livello_acqua"><valore>8</valore></varOsservata><varOsservata nome="stato_erogazione"><valore>finita</valore></varOsservata><varOsservata nome="stato_cialda"><valore>non inserita</valore></varOsservata></stato><stato timestamp="18-9-2020-15-00-08"><varOsservata nome="stato_accensione"><valore>spenta</valore></varOsservata><varOsservata nome="temperatura_macchinetta"><valore>10</valore></varOsservata><varOsservata nome="livello_acqua"><valore>8</valore></varOsservata><varOsservata nome="stato_erogazione"><valore>finita</valore></varOsservata><varOsservata nome="stato_cialda"><valore>non inserita</valore></varOsservata></stato><stato timestamp="18-9-2020-15-00-37"><varOsservata nome="stato_accensione"><valore>spenta</valore></varOsservata><varOsservata nome="temperatura_macchinetta"><valore>10</valore></varOsservata><varOsservata nome="livello_acqua"><valore>8</valore></varOsservata><varOsservata nome="stato_erogazione"><valore>finita</valore></varOsservata><varOsservata nome="stato_cialda"><valore>non inserita</valore></varOsservata></stato><stato timestamp="18-9-2020-15-00-41"><varOsservata nome="stato_accensione"><valore>spenta</valore></varOsservata><varOsservata nome="temperatura_macchinetta"><valore>5</valore></varOsservata><varOsservata nome="livello_acqua"><valore>8</valore></varOsservata><varOsservata nome="stato_erogazione"><valore>finita</valore></varOsservata><varOsservata nome="stato_cialda"><valore>non inserita</valore></varOsservata></stato><stato timestamp="18-9-2020-15-11-21"><varOsservata nome="stato_accensione"><valore>spenta</valore></varOsservata><varOsservata nome="temperatura_macchinetta"><valore>5</valore></varOsservata><varOsservata nome="livello_acqua"><valore>8</valore></varOsservata><varOsservata nome="stato_erogazione"><valore>finita</valore></varOsservata><varOsservata nome="stato_cialda"><valore>non inserita</valore></varOsservata></stato><stato timestamp="18-9-2020-15-12-43"><varOsservata nome="stato_accensione"><valore>spenta</valore></varOsservata><varOsservata nome="temperatura_macchinetta"><valore>5</valore></varOsservata><varOsservata nome="livello_acqua"><valore>8</valore></varOsservata><varOsservata nome="stato_erogazione"><valore>finita</valore></varOsservata><varOsservata nome="stato_cialda"><valore>non inserita</valore></varOsservata></stato><stato timestamp="18-9-2020-15-15-15"><varOsservata nome="stato_accensione"><valore>spenta</valore></varOsservata><varOsservata nome="temperatura_macchinetta"><valore>0</valore></varOsservata><varOsservata nome="livello_acqua"><valore>8</valore></varOsservata><varOsservata nome="stato_erogazione"><valore>finita</valore></varOsservata><varOsservata nome="stato_cialda"><valore>non inserita</valore></varOsservata></stato><stato timestamp="18-9-2020-16-36-21"><varOsservata nome="stato_accensione"><valore>spenta</valore></varOsservata><varOsservata nome="temperatura_macchinetta"><valore>0</valore></varOsservata><varOsservata nome="livello_acqua"><valore>8</valore></varOsservata><varOsservata nome="stato_erogazione"><valore>finita</valore></varOsservata><varOsservata nome="stato_cialda"><valore>non inserita</valore></varOsservata></stato><stato timestamp="18-9-2020-16-39-15"><varOsservata nome="stato_accensione"><valore>spenta</valore></varOsservata><varOsservata nome="temperatura_macchinetta"><valore>0</valore></varOsservata><varOsservata nome="livello_acqua"><valore>8</valore></varOsservata><varOsservata nome="stato_erogazione"><valore>finita</valore></varOsservata><varOsservata nome="stato_cialda"><valore>non inserita</valore></varOsservata></stato></stati>
